urn,title,page_start,page_end,overlapp,digital_visning,comment,text,_merge
URN:NBN:no-nb_digibok_2006082400076,3,,,,,,"160 


3: 
Waar man er liden, er Derden det med: et Hav er en 
Vandpyt, 
Derdens Grænser ei naar udenfor Moderens Arm. – 
Blir man da Barn igjen, naar man elsker? – Næsten jeg 
tror det: 
Nu er et Blik mig et Hav, – Verden min elskedes Favn! 


4. 
Derjom der gives en Lethe,  en Glemselens Flod efter 
Døden, – 
$ad det da synke deri, Mindet om Jordlivets Tant. 
Et kun jeg beder til Gud, at han aldrig maa lade mig 
glemme: 
Det er hver Stund, da jeg alt, alt hos min elskte har glemt! 


3 
Sior er den, som for frihedens Sag erobrer en Verden, 
God er den, som sig selv offrer for Sandhed og Ret 
Lykkelig er blot den, som erobrer et elskende Hjerte, 
Og som faar offre sit Liv trofast mod den, han har kjær! 


g 


",right_only
URN:NBN:no-nb_digibok_2006082400076,11,,,,,,"164 


11. 
Den, som meget har, skal meget gives,» 
Dette Ord mig tidt i Minde randt, – 
,Men fra den, der lidet har, skal rives 
Selv de usle Smuler, som han fandt.” 


Lykkens Undling vant til letfjøbt Seier 
CTusind Hjerter flyver i hans Favn. 
men hvis blot et eneste man eier, 
Snart man sidder ensom med sit Savn. 


E 


12. 
3 prøver Guld, 
Og ød prøver Venner; 
men Kjærligheds Magt 
I Sorgen man kjender. 


Dens Vugge er Kjod, 
men Aand er dens Daab; 
Den lever i Minder 

Og dør i Haab. 


æ-- 


",right_only
URN:NBN:no-nb_digibok_2006082400076,14,,,,,,"165 


13. 
Englene synded, og Herren i Vrede 
Bort dem til Helvedes Afgrund forviste 
Da blev paa Trods deres eneste Glæde 
Kampen mod Ham, de fra Evighed priste 


Glemte de da for de dødsdømtes Klage 
Lovsangen rundt om Alkjærligheds Trone? 
Droges de aldrig af Længsel tilbage 

Efter med Anger sin Skyld at forsone? 


– frafaldne Engle, jeg fatter jer Smerte, 
Fatter jer Trods mod den himmelske Fader: 
Den, man har elsket af varmeste Hjerte, 
Stærkest man afskyr og dybest man hader! 


14. 

Crø ei, saa blir du ei truffet 
Af Tvilens stikkende Brodd; 
Haab ei, saa blir du ei skuffet, 
Naar Lykken nægter dig Lodd; 
Elsk ei, saa faar du ei kjende 
Sorg over troløs Mø; – 

Mmen saa kan du ogsaa vende 
Derden din Rygg – og dø! 


8* 


",right_only
URN:NBN:no-nb_digibok_2006082400076,1,,,,,,"; 


Ahning skifter,  hvad nyt er idag, er gammelt imorgen, 


Tanker, Bedrifter og Ord synker i Glemselens Grav. 

Et kun jeg ved, som ei Tiden raar med: det er Kjærligheds 
Gaade; – 

Gammel som Verden den blir evig dog uløst og ny! 


2. 


Tærf efter Varme og Regn er Jorden i Vaarbruddets 
Smeltning, 
Vaad af den glinsende Dugg suger den Solstraalens Ild. 
Saadan i Længslernes Vaar efter Kjærlighed smægter mit 
Bjerte, 
Og for hvert Kjærtegn, jeg faar, fordrer jeg tusind igjen! 


",right_only
URN:NBN:no-nb_digibok_2006082400076,7,,,,,,"161 


6. 
De rigeste Stunder 
3 menneskelivet 
De blev ikke Seiren, 
Mmen Tabet givet: 
Naar viljeløs Sjælen 
En anden man skjænker, 
Da løses først Selvets 
Forsnevrende Lænker. 


De rigeste Stunder 
I Menneffelivet 

De blev ikke Aanden, 
Mmen Hjertet givet: 
Naar Læberne tier, 
Og Øinene taler, 
Da er det, at Himlen 
Til Jorden daler! 


7. 
A Lykken i Livet findes, 
Ei nogen nægte vil: 
«En ytte og et Hjerte,"" – 
Der skal ei mere til. 



162 


Og Hytten kan hver sig tømre 
Ded Taalmod Stok for Stok; – 
men Hjertets Plads at fylde 
Gaar ofte tungvindt nok! 


8. 
Jeg elsked, jeg leved, jeg jubled, jeg sang 
Og tænkte, det aldrig blev Høst. 
Jeg tabte min elskte, og skurrende klang 
For Øret en klagende Røst: 


Er ikke al Lykke, om lang eller kort, 

En skuffende Indbildning kun? 

Og er ikke Glæden en Brøde, som haardt 
Maa sones i Angerens Stund? 


* 


tkas Mandens Kjærlighed vaagner, 
Den taaler Pygmalions Kaar: 

En Støtte gjerne han favner, 

Naar han blot favne faar. 


",right_only
URN:NBN:no-nb_digibok_2006082400076,12,,,,,,"164 


11. 
Den, som meget har, skal meget gives,» 
Dette Ord mig tidt i Minde randt, – 
,Men fra den, der lidet har, skal rives 
Selv de usle Smuler, som han fandt.” 


Lykkens Undling vant til letfjøbt Seier 
CTusind Hjerter flyver i hans Favn. 
men hvis blot et eneste man eier, 
Snart man sidder ensom med sit Savn. 


E 


12. 
3 prøver Guld, 
Og ød prøver Venner; 
men Kjærligheds Magt 
I Sorgen man kjender. 


Dens Vugge er Kjod, 
men Aand er dens Daab; 
Den lever i Minder 

Og dør i Haab. 


æ-- 


",right_only
URN:NBN:no-nb_digibok_2006082400076,8,,,,,,"162 


Og Hytten kan hver sig tømre 
Ded Taalmod Stok for Stok; – 
men Hjertets Plads at fylde 
Gaar ofte tungvindt nok! 


8. 
Jeg elsked, jeg leved, jeg jubled, jeg sang 
Og tænkte, det aldrig blev Høst. 
Jeg tabte min elskte, og skurrende klang 
For Øret en klagende Røst: 


Er ikke al Lykke, om lang eller kort, 

En skuffende Indbildning kun? 

Og er ikke Glæden en Brøde, som haardt 
Maa sones i Angerens Stund? 


* 


tkas Mandens Kjærlighed vaagner, 
Den taaler Pygmalions Kaar: 

En Støtte gjerne han favner, 

Naar han blot favne faar. 


",right_only
